week_start,week_end,date,day_name,sport,session_type,title,surface,duration_min,distance_km,pace_min_per_km,speed_km_h,elevation_gain_m,intensity,rpe,notes
2026-02-20,2026-02-26,2026-02-20,Piątek,squash,moderate,Squash (zaplanowany),indoor,60,,,,,"Umiarkowanie (technicznie, bez wchodzenia na max)",6,"Zaplanowane w `data/planned_sessions.csv`. Po skiturach: gra bardziej techniczna, kontrola ruchu, bez maksymalnych zrywów jeśli kolana dają sygnały. Po: 8–10' mobilność biodro/łydka/stopa."
2026-02-20,2026-02-26,2026-02-21,Sobota,run,easy,"Bieg EASY (krótko, bez szarpania)",mixed,45,8,05:38,10.7,0,Luźno,3,40–50' bardzo luźno (RPE 3–4). Preferuj bieżnię/miękki teren. Bez przebieżek. Jeśli kolano dojdzie do 3/10 albo narasta → kończysz (marsz).
2026-02-20,2026-02-26,2026-02-22,Niedziela,run,easy,Długi bieg EASY (krócej po sobotnim biegu),trail,65,10.5,06:11,9.7,200,Luźno (tlen),4,"60–70' w spokojnym tlenie. Na zbiegach krótszy krok, miękko, żadnego „latania”. Jeśli sobota była cięższa niż plan / czujesz kolana → skróć do 50–60'. Jeśli ślisko/oblodzenie → bieżnia 60–65' luźno (1–3% nachylenia przez środek)."
2026-02-20,2026-02-26,2026-02-23,Poniedziałek,strength,strength,"Siła + stabilizacja (krótko, bez DOMS)",,35,,,,,Lekko,3,"30–40': split squat (kontrola kolana), RDL na jednej nodze lub klasyczny lekki, pośladek (bridge/hip thrust), core. Łydki: 2×45–60"" izo (proste + ugięte). Ma zostać zapas na wt/śr."
2026-02-20,2026-02-26,2026-02-24,Wtorek,run,easy,Bieg EASY + opcjonalnie przebieżki,mixed,50,9,05:33,10.8,0,Luźno,4,"45–55' luźno. Jeśli warunki śliskie → bieżnia. Jeśli kolana/Achilles 0–1/10 i czujesz luz → na końcu 4×20"" luźne przebieżki (pełny luz, nie sprint). Jeśli jakikolwiek sygnał z kolan → bez przebieżek."
2026-02-20,2026-02-26,2026-02-25,Środa,bike,easy,Rower ~70 km (zaplanowany) — tlen/Z2,road,180,70,02:34,23.3,,Tlen / Z2 (bez ścigania),4,"Zaplanowane w `data/planned_sessions.csv`. 70 km spokojnie (Z2), równa moc/tempo, bez szarpania na podjazdach. Kadencja 85–95, unikaj ciężkich przełożeń (kolana). Paliwo: jeśli >2h to 30–60 g węgli/h + regularne picie. Jeśli kolana w trakcie >2/10 lub narasta dyskomfort → skróć i wróć spokojnie."
2026-02-20,2026-02-26,2026-02-26,Czwartek,swim,easy,Basen luźno (nisko‑udarowo) + mobilność,pool_indoor,40,1.2,33:20,1.8,,Lekko (tlen),2,"30–40' luźno + technika. Po: 10–15' mobilność + 2×45–60"" izo łydki (proste + ugięte). Jeśli wolisz pobiegać zamiast basenu: tylko gdy kolana 0–1/10 i bez sztywności — wtedy 30–40' luźno na bieżni."
